<?xml version="1.0" encoding="UTF-8"?>
<mapping xmlns="http://www.l2emu-unique.net" xmlns:xsi="http://www.w3.org/2001/XMLSchema-instance" xsi:schemaLocation="http://www.l2emu-unique.net ../../schemata/mapping.xsd">
	<client>
		<packet opcodePrefix="D0 36 00" id="231" />
		<packet opcodePrefix="D0 5A 00" id="277" />
		<packet opcodePrefix="D0 7F 00" id="353" />
		<packet opcodePrefix="D0 80 00" id="354" />
		<packet opcodePrefix="D0 81 00" id="355" />
		<packet opcodePrefix="D0 82 00" id="356" />
		<packet opcodePrefix="D0 91 00" id="357" />
		<packet opcodePrefix="D0 92 00" id="358" />
		<packet opcodePrefix="D0 93 00" id="359" />
		<packet opcodePrefix="D0 94 00" id="360" />
		<packet opcodePrefix="D0 95 00" id="361" />
		<packet opcodePrefix="D0 96 00 02 00 00 00" id="362" />
		<packet opcodePrefix="D0 96 00 03 00 00 00" id="363" />
		<packet opcodePrefix="D0 96 00 04 00 00 00" id="364" />
		<packet opcodePrefix="D0 97 00" id="365" />
		<packet opcodePrefix="D0 98 00" id="366" />
		<packet opcodePrefix="D0 99 00" id="367" />
		<packet opcodePrefix="D0 9A 00" id="368" />
		<packet opcodePrefix="D0 9B 00" id="369" />
		<packet opcodePrefix="D0 9C 00" id="370" />
		<packet opcodePrefix="D0 9D 00" id="371" />
		<packet opcodePrefix="D0 9E 00" id="372" />
		<packet opcodePrefix="D0 9F 00" id="373" />
		<packet opcodePrefix="D0 A0 00" id="374" />
		<packet opcodePrefix="D0 A1 00" id="375" />
		<packet opcodePrefix="D0 A2 00" id="376" />
		<packet opcodePrefix="D0 A3 00" id="377" />
		<packet opcodePrefix="D0 A4 00" id="378" />
		<packet opcodePrefix="D0 A5 00" id="379" />
		<packet opcodePrefix="D0 A6 00" id="380" />
		<packet opcodePrefix="D0 A7 00" id="381" />
		<packet opcodePrefix="D0 A8 00" id="462" />
		<packet opcodePrefix="D0 A9 00" id="463" />
		<packet opcodePrefix="D0 AA 00" id="464" />
		<packet opcodePrefix="D0 AB 00" id="465" />
		<packet opcodePrefix="D0 AC 00" id="348" />
		<packet opcodePrefix="D0 AD 00" id="322" />
		<packet opcodePrefix="D0 AE 00" id="323" />
		<packet opcodePrefix="D0 AF 00" id="324" />
		<packet opcodePrefix="D0 B0 00" id="349" />
		<packet opcodePrefix="D0 B1 00" id="346" />
		<packet opcodePrefix="D0 B2 00" id="347" />
		<packet opcodePrefix="D0 B3 00" id="382" />
		<packet opcodePrefix="D0 B4 00" id="383" />
		<packet opcodePrefix="D0 B5 00" id="384" />
		<packet opcodePrefix="D0 B7 00" id="385" />
		<packet opcodePrefix="D0 B8 00" id="386" />
		<packet opcodePrefix="D0 B9 00" id="387" />
		<packet opcodePrefix="D0 BA 00" id="466" />
		<packet opcodePrefix="D0 BB 00" id="388" />
		<packet opcodePrefix="D0 BC 00" id="389" />
		<packet opcodePrefix="D0 BD 00" id="390" />
		<packet opcodePrefix="D0 BE 00" id="391" />
		<packet opcodePrefix="D0 BF 00" id="392" />
		<packet opcodePrefix="D0 C0 00" id="393" />
		<packet opcodePrefix="D0 C1 00" id="394" />
		<packet opcodePrefix="D0 C2 00" id="395" />
		<packet opcodePrefix="D0 CC 00" id="405" />
		<packet opcodePrefix="D0 CD 00" id="406" />
		<packet opcodePrefix="D0 CE 00" id="407" />
		<packet opcodePrefix="D0 CF 00" id="408" />
	</client>
	<server>
		<!-- Replaced by SM_FRIEND_ADD_REQUEST_RESULT and SM_FRIEND_REMOVE since GoD -->
		<removedPacket id="SM_L2_FRIEND" />
		<packet opcodePrefix="FE 00 00" id="533" />
		<packet opcodePrefix="FE BD 00" id="492" />
		<packet opcodePrefix="FE DF 00" id="538" />
		<packet opcodePrefix="FE E0 00" id="539" />
		<packet opcodePrefix="FE E1 00" id="540" />
		<packet opcodePrefix="FE E2 00" id="515" />
		<packet opcodePrefix="FE E3 00" id="516" />
		<packet opcodePrefix="FE E4 00" id="517" />
		<packet opcodePrefix="FE E5 00" id="541" />
		<packet opcodePrefix="FE E6 00" id="542" />
		<packet opcodePrefix="FE E7 00" id="543" />
		<packet opcodePrefix="FE E8 00" id="544" />
		<packet opcodePrefix="FE E9 00" id="545" />
		<packet opcodePrefix="FE EA 00" id="546" />
		<packet opcodePrefix="FE EB 00" id="547" />
		<packet opcodePrefix="FE EC 00" id="548" />
		<packet opcodePrefix="FE ED 00" id="549" />
		<packet opcodePrefix="FE EE 00" id="550" />
		<packet opcodePrefix="FE EF 00" id="551" />
		<packet opcodePrefix="FE F0 00" id="552" />
		<packet opcodePrefix="FE F1 00" id="553" />
		<packet opcodePrefix="FE F2 00" id="554" />
		<packet opcodePrefix="FE F3 00" id="555" />
		<packet opcodePrefix="FE F4 00" id="556" />
		<packet opcodePrefix="FE F5 00" id="557" />
		<packet opcodePrefix="FE F6 00" id="558" />
		<packet opcodePrefix="FE F7 00" id="559" />
		<packet opcodePrefix="FE F8 00" id="560" />
		<packet opcodePrefix="FE F9 00" id="561" />
		<packet opcodePrefix="FE FA 00" id="562" />
		<packet opcodePrefix="FE FB 00" id="563" />
		<packet opcodePrefix="FE FC 00" id="564" />
		<packet opcodePrefix="FE FD 00" id="565" />
		<packet opcodePrefix="FE FE 00" id="566" />
		<packet opcodePrefix="FE FF 00" id="567" />
		<packet opcodePrefix="FE 00 01" id="568" />
		<packet opcodePrefix="FE 01 01" id="569" />
		<packet opcodePrefix="FE 02 01" id="570" />
		<packet opcodePrefix="FE 03 01" id="682" />
		<packet opcodePrefix="FE 04 01" id="683" />
		<packet opcodePrefix="FE 05 01" id="684" />
		<packet opcodePrefix="FE 06 01" id="685" />
		<packet opcodePrefix="FE 07 01" id="686" />
		<packet opcodePrefix="FE 08 01" id="687" />
		<packet opcodePrefix="FE 09 01" id="521" />
		<packet opcodePrefix="FE 0A 01" id="522" />
		<packet opcodePrefix="FE 0B 01" id="523" />
		<packet opcodePrefix="FE 0C 01" id="572" />
		<packet opcodePrefix="FE 0D 01" id="573" />
		<packet opcodePrefix="FE 0E 01" id="574" />
		<packet opcodePrefix="FE 0F 01" id="575" />
		<packet opcodePrefix="FE 10 01" id="518" />
		<packet opcodePrefix="FE 11 01" id="519" />
		<packet opcodePrefix="FE 12 01" id="520" />
		<packet opcodePrefix="FE 13 01" id="576" />
		<packet opcodePrefix="FE 14 01" id="577" />
		<packet opcodePrefix="FE 15 01" id="456" />
		<packet opcodePrefix="FE 16 01" id="578" />
		<packet opcodePrefix="FE 17 01" id="579" />
		<packet opcodePrefix="FE 18 01" id="580" />
		<packet opcodePrefix="FE 19 01" id="581" />
		<packet opcodePrefix="FE 1A 01" id="582" />
		<packet opcodePrefix="FE 1B 01" id="688" />
		<packet opcodePrefix="FE 1C 01" id="583" />
		<packet opcodePrefix="FE 1D 01" id="584" />
		<packet opcodePrefix="FE 1E 01" id="585" />
		<packet opcodePrefix="FE 1F 01" id="586" />
		<packet opcodePrefix="FE 20 01" id="587" />
		<packet opcodePrefix="FE 21 01" id="588" />
		<packet opcodePrefix="FE 22 01" id="589" />
		<packet opcodePrefix="FE 23 01" id="601" />
		<packet opcodePrefix="FE 24 01" id="602" />
		<packet opcodePrefix="FE 25 01" id="603" />
		<packet opcodePrefix="FE 26 01" id="604" />
		<packet opcodePrefix="FE 27 01" id="617" />
	</server>
</mapping>
