<?xml version="1.0" encoding="UTF-8"?>
<mapping xmlns="http://www.l2emu-unique.net" xmlns:xsi="http://www.w3.org/2001/XMLSchema-instance" xsi:schemaLocation="http://www.l2emu-unique.net ../../schemata/mapping.xsd">
	<client>
		<packet opcodePrefix="D0 73 00" id="314" />
		<packet opcodePrefix="D0 74 00" id="315" />
		<packet opcodePrefix="D0 78 00" id="316" />
		<packet opcodePrefix="D0 79 00" id="317" />
		<packet opcodePrefix="D0 7A 00" id="318" />
		<packet opcodePrefix="D0 7B 00" id="310" />
		<packet opcodePrefix="D0 7C 00" id="319" />
		<packet opcodePrefix="D0 7D 00" id="320" />
		<packet opcodePrefix="D0 7E 00" id="321" />
		<packet opcodePrefix="D0 7F 00" id="288" />
		<packet opcodePrefix="D0 80 00" id="289" />
		<packet opcodePrefix="D0 81 00" id="290" />
		<packet opcodePrefix="D0 82 00" id="291" />
		<packet opcodePrefix="D0 83 00" id="309" />
		<packet opcodePrefix="D0 84 00" id="311" />
		<packet opcodePrefix="D0 85 00" id="312" />
		<packet opcodePrefix="D0 86 00" id="313" />
	</client>
	<server>
		<packet opcodePrefix="FE B5 00" id="487" />
		<packet opcodePrefix="FE B8 00" id="488" />
		<packet opcodePrefix="FE B9 00" id="489" />
		<packet opcodePrefix="FE BA 00" id="490" />
		<packet opcodePrefix="FE BB 00" id="491" />
		<packet opcodePrefix="FE BC 00" id="484" />
		<packet opcodePrefix="FE BD 00" id="492" />
		<packet opcodePrefix="FE BE 00" id="493" />
		<packet opcodePrefix="FE BF 00" id="494" />
		<packet opcodePrefix="FE C0 00" id="495" />
		<packet opcodePrefix="FE C1 00" id="496" />
		<packet opcodePrefix="FE C2 00" id="497" />
		<packet opcodePrefix="FE C3 00" id="498" />
		<packet opcodePrefix="FE C4 00" id="499" />
		<packet opcodePrefix="FE C5 00" id="500" />
		<packet opcodePrefix="FE C6 00" id="501" />
		<packet opcodePrefix="FE C7 00" id="502" />
		<packet opcodePrefix="FE C8 00" id="503" />
		<packet opcodePrefix="FE C9 00" id="457" />
		<packet opcodePrefix="FE CA 00" id="458" />
		<packet opcodePrefix="FE CB 00" id="459" />
		<packet opcodePrefix="FE CC 00" id="460" />
		<packet opcodePrefix="FE CD 00" id="537" />
		<packet opcodePrefix="FE CE 00" id="463" />
		<packet opcodePrefix="FE CF 00" id="462" />
		<packet opcodePrefix="FE D0 00" id="466" />
		<packet opcodePrefix="FE D1 00" id="483" />
		<packet opcodePrefix="FE D2 00" id="485" />
		<packet opcodePrefix="FE D3 00" id="486" />
	</server>
</mapping>
